wav,wrd,ID,duration,sr
C:/Bradai/focus/AI_ASR_model/new/audio_asr/audio_wav_298.wav ,جعت تعطيني ناكل معاك,198,4.14,48000
C:/Bradai/focus/AI_ASR_model/new/audio_asr/audio_wav_299.wav ,والله ما نشدش عليك يا ولد عمي,199,3.82,48000
C:/Bradai/focus/AI_ASR_model/new/audio_asr/audio_wav_400.wav ,لكن احنا توا في طريق طويلة,200,3.39,48000
C:/Bradai/focus/AI_ASR_model/new/audio_asr/audio_wav_401.wav ,والمونة هذي لازمها تشدني حتى نوصل,201,3.68,48000
C:/Bradai/focus/AI_ASR_model/new/audio_asr/audio_wav_402.wav ,كان تحب ع الماكلة تفضل خوذ شطرها اما على شرط,202,4.33,48000
C:/Bradai/focus/AI_ASR_model/new/audio_asr/audio_wav_403.wav ,تعطيني هاك الصرة,203,2.83,48000
C:/Bradai/focus/AI_ASR_model/new/audio_asr/audio_wav_404.wav ,لكن الجوع ما يقدرش عليه,204,3.72,48000

