wav,wrd,ID,duration,sr
C:/Bradai/focus/AI_ASR_model/new/audio_asr/audio_wav_1.wav   ,بكلنا نعرفو حكايات بوك عكرك و الغول,1,4.12,48000
C:/Bradai/focus/AI_ASR_model/new/audio_asr/audio_wav_2.wav   ,شكون ما حكاتهالوش ماماتو في صغرتو,2,4.04,48000
C:/Bradai/focus/AI_ASR_model/new/audio_asr/audio_wav_3.wav   ,و ما يتفكرهاش ولو البعض منها و لو كليمات,3,4.3,48000
C:/Bradai/focus/AI_ASR_model/new/audio_asr/audio_wav_4.wav   ,مرة نقرى في كتاب فرنساوي متع حكايات,4,4.5,48000
C:/Bradai/focus/AI_ASR_model/new/audio_asr/audio_wav_5.wav   ,لقيت حكاية تشبه لهاذي,5,4.03,48000
C:/Bradai/focus/AI_ASR_model/new/audio_asr/audio_wav_6.wav   ,هي ماهي الحكايات الكل تتسلف من بعضها,6,4.34,48000
C:/Bradai/focus/AI_ASR_model/new/audio_asr/audio_wav_7.wav   ,و ساعات نحكيلكم حكاية من الأندلس والا من الهند والا من الجابون,7,5.73,48000
C:/Bradai/focus/AI_ASR_model/new/audio_asr/audio_wav_8.wav   ,و هي كاينها حكاية من حكاياتنا,8,3.89,48000
C:/Bradai/focus/AI_ASR_model/new/audio_asr/audio_wav_9.wav   ,و تلقاها في أغلب الأوقات,9,3.06,48000
C:/Bradai/focus/AI_ASR_model/new/audio_asr/audio_wav_10.wav  ,ما تختلف على حكاياتنا إلا في بعض جزئيات,10,4.43,48000
C:/Bradai/focus/AI_ASR_model/new/audio_asr/audio_wav_11.wav  ,هذا يا سيدي قالك واحد تارزي,11,3.61,48000
C:/Bradai/focus/AI_ASR_model/new/audio_asr/audio_wav_12.wav  ,قاعد في حانوتو يخيط,12,3.33,48000
C:/Bradai/focus/AI_ASR_model/new/audio_asr/audio_wav_13.wav  ,تعدات مرا تبيع في المعجون,13,2.86,48000
C:/Bradai/focus/AI_ASR_model/new/audio_asr/audio_wav_14.wav  ,شرى من عندها وقية,14,2.91,48000
C:/Bradai/focus/AI_ASR_model/new/audio_asr/audio_wav_15.wav  ,و عندو خبزة في الحانوت,15,2.98,48000
C:/Bradai/focus/AI_ASR_model/new/audio_asr/audio_wav_16.wav  ,قصها شقها على ثنين,16,2.94,48000
C:/Bradai/focus/AI_ASR_model/new/audio_asr/audio_wav_17.wav  ,و حط هاك المعجون على شطرها بش يفطر وقعد يخيط,17,5.05,48000
C:/Bradai/focus/AI_ASR_model/new/audio_asr/audio_wav_18.wav  ,حتى يكمل بش يفطر,18,2.64,48000
C:/Bradai/focus/AI_ASR_model/new/audio_asr/audio_wav_19.wav  ,و إذا بيه ذبان الدنيا و الدين,19,3.51,48000
C:/Bradai/focus/AI_ASR_model/new/audio_asr/audio_wav_20.wav  ,تلم على هاك طرف الخبز هذاكا بالمعجون,20,5.05,48000
C:/Bradai/focus/AI_ASR_model/new/audio_asr/audio_wav_21.wav  ,بدا ينش بيدو,21,2.82,48000
C:/Bradai/focus/AI_ASR_model/new/audio_asr/audio_wav_22.wav  ,ضربة من الضربات لصقت يدو في المعجون,22,4.09,48000
C:/Bradai/focus/AI_ASR_model/new/audio_asr/audio_wav_23.wav  ,كيف هزها يلقى سبعة ذبانات لاصقين فيها,23,4.19,48000
C:/Bradai/focus/AI_ASR_model/new/audio_asr/audio_wav_24.wav  ,في ضربة واحدة نطيح سبعة أرواح,24,3.61,48000
C:/Bradai/focus/AI_ASR_model/new/audio_asr/audio_wav_25.wav  ,و مازلت قاعد في البلاد هاذي,25,3.06,48000
C:/Bradai/focus/AI_ASR_model/new/audio_asr/audio_wav_26.wav  ,هالبلاد هاذي ما عادش ترفعني,26,2.83,48000
C:/Bradai/focus/AI_ASR_model/new/audio_asr/audio_wav_27.wav  ,ما عادتش من قدري,27,2.32,48000
C:/Bradai/focus/AI_ASR_model/new/audio_asr/audio_wav_28.wav  ,تارزي زادا,28,2.18,48000
C:/Bradai/focus/AI_ASR_model/new/audio_asr/audio_wav_29.wav  ,لا يا سيدي,29,1.91,48000
C:/Bradai/focus/AI_ASR_model/new/audio_asr/audio_wav_30.wav  ,و جبد فصل طرف قماش عملو محزمة و طرز عليها,30,4.71,48000
C:/Bradai/focus/AI_ASR_model/new/audio_asr/audio_wav_31.wav  ,ربيع كارطة كيما يقولو,31,3.23,48000
C:/Bradai/focus/AI_ASR_model/new/audio_asr/audio_wav_32.wav  ,بنفخة تطيرو مش بكف,32,3.23,48000
C:/Bradai/focus/AI_ASR_model/new/audio_asr/audio_wav_33.wav  ,خرج يدورلك في البلاد يا سيدي,33,3.8,48000
C:/Bradai/focus/AI_ASR_model/new/audio_asr/audio_wav_34.wav  ,اللي يشوفو يقرى هاك الكتيبة هذيكا ينقز يجي لغادي,34,4.62,48000
C:/Bradai/focus/AI_ASR_model/new/audio_asr/audio_wav_35.wav  ,حتى وصل لباب البلاد,35,2.64,48000
C:/Bradai/focus/AI_ASR_model/new/audio_asr/audio_wav_36.wav  ,كيف جا بش يخرج من الحانوت,36,3.03,48000
C:/Bradai/focus/AI_ASR_model/new/audio_asr/audio_wav_37.wav  ,عندو طرف جبن,37,2.63,48000
C:/Bradai/focus/AI_ASR_model/new/audio_asr/audio_wav_38.wav  ,حطو في مكتوبو,38,1.8,48000
C:/Bradai/focus/AI_ASR_model/new/audio_asr/audio_wav_39.wav  ,عوينو يقولك كيف يجوع,39,2.96,48000
C:/Bradai/focus/AI_ASR_model/new/audio_asr/audio_wav_40.wav  ,في الحانوت بدا يطير و يضرب في الحيوط,40,3.89,48000
C:/Bradai/focus/AI_ASR_model/new/audio_asr/audio_wav_41.wav  ,بدا هو يحاصر فيه,41,2.45,48000
C:/Bradai/focus/AI_ASR_model/new/audio_asr/audio_wav_42.wav  ,يحاصر فيه حتى شدو و رماه بالطول,42,3.42,48000
C:/Bradai/focus/AI_ASR_model/new/audio_asr/audio_wav_43.wav  ,أيا خرج من البلاد,43,2.82,48000
C:/Bradai/focus/AI_ASR_model/new/audio_asr/audio_wav_44.wav  ,دخل للغابة,44,2.27,48000
C:/Bradai/focus/AI_ASR_model/new/audio_asr/audio_wav_45.wav  ,يعرضو غول طولو عام و عرضو,45,3.21,48000
C:/Bradai/focus/AI_ASR_model/new/audio_asr/audio_wav_46.wav  ,المنظر متاعو يفجع يطيح الدمار في الركايب,46,4.38,48000
C:/Bradai/focus/AI_ASR_model/new/audio_asr/audio_wav_47.wav  ,قام يضحك هاك الغول,47,2.24,48000
C:/Bradai/focus/AI_ASR_model/new/audio_asr/audio_wav_48.wav  ,نا نسخايل بش نلقى بن آدم كامل بش نفطر بيه,48,4.28,48000
C:/Bradai/focus/AI_ASR_model/new/audio_asr/audio_wav_49.wav  ,لا انت تنجمني,49,2.71,48000
C:/Bradai/focus/AI_ASR_model/new/audio_asr/audio_wav_50.wav  ,تي آنا أصح من عشرة منك,50,2.86,48000
C:/Bradai/focus/AI_ASR_model/new/audio_asr/audio_wav_51.wav  ,إي نعم,51,2.16,48000
C:/Bradai/focus/AI_ASR_model/new/audio_asr/audio_wav_52.wav  ,شوف هالكتيبة هذيا,52,3.68,48000
C:/Bradai/focus/AI_ASR_model/new/audio_asr/audio_wav_53.wav  ,تي أيا نشوفو شكون أصح مالا م الثنين,53,3.92,48000
C:/Bradai/focus/AI_ASR_model/new/audio_asr/audio_wav_54.wav  ,قعد يتلفت و يفركس,54,3.03,48000
C:/Bradai/focus/AI_ASR_model/new/audio_asr/audio_wav_55.wav  ,و منها طبس هز حجرة حطها في كفو و بدا ينزل عليها,55,5.16,48000
C:/Bradai/focus/AI_ASR_model/new/audio_asr/audio_wav_56.wav  ,حتى قطر منها الماء,56,3.13,48000
C:/Bradai/focus/AI_ASR_model/new/audio_asr/audio_wav_57.wav  ,تنجم تعمل هكا إنت,57,2.57,48000
C:/Bradai/focus/AI_ASR_model/new/audio_asr/audio_wav_58.wav  ,مالا لا,58,2.11,48000
C:/Bradai/focus/AI_ASR_model/new/audio_asr/audio_wav_59.wav  ,ياخي آش تسخايلني,59,3.56,48000
C:/Bradai/focus/AI_ASR_model/new/audio_asr/audio_wav_60.wav  ,ولد المرا ما يتحقرش راهو,60,2.81,48000
C:/Bradai/focus/AI_ASR_model/new/audio_asr/audio_wav_61.wav  ,و خرج هاك الطرف جبن اللي في مكتوبو و طبس عمل نفسو هز حجرة,61,5.66,48000
C:/Bradai/focus/AI_ASR_model/new/audio_asr/audio_wav_62.wav  ,و نزل على هاك الطرف جبن هذاكا,62,3.36,48000
C:/Bradai/focus/AI_ASR_model/new/audio_asr/audio_wav_63.wav  ,نا الحجرة,63,2.34,48000
C:/Bradai/focus/AI_ASR_model/new/audio_asr/audio_wav_64.wav  ,نخرج منها الماء برك,64,2.57,48000
C:/Bradai/focus/AI_ASR_model/new/audio_asr/audio_wav_65.wav  ,حليب أمها نخرجو,65,2.94,48000
C:/Bradai/focus/AI_ASR_model/new/audio_asr/audio_wav_66.wav  ,ولى الغول يغزرلو بعين أخرى,66,3.12,48000
C:/Bradai/focus/AI_ASR_model/new/audio_asr/audio_wav_67.wav  ,مليح أيا,67,2.14,48000
C:/Bradai/focus/AI_ASR_model/new/audio_asr/audio_wav_68.wav  ,هاو نرمي حجرة و نشوفو تنجمش تشيعها إنت قد ما نشيعها,68,5.58,48000
C:/Bradai/focus/AI_ASR_model/new/audio_asr/audio_wav_69.wav  ,و خطف حجرة رماها لفوق في السماء و هبطت,69,4.23,48000
C:/Bradai/focus/AI_ASR_model/new/audio_asr/audio_wav_70.wav  ,عاد هذي هاو شي,70,2.56,48000
C:/Bradai/focus/AI_ASR_model/new/audio_asr/audio_wav_71.wav  ,و جبد هاك العصفور هذاكا من مكتوبو و شيعو,71,3.95,48000
C:/Bradai/focus/AI_ASR_model/new/audio_asr/audio_wav_72.wav  ,طار طلع للسماء ما رجعش,72,3.16,48000
C:/Bradai/focus/AI_ASR_model/new/audio_asr/audio_wav_73.wav  ,نا الحجرة اللي نرميها ما ترجعش,73,3.34,48000
C:/Bradai/focus/AI_ASR_model/new/audio_asr/audio_wav_74.wav  ,تمشي في خبر كان,74,2.79,48000
C:/Bradai/focus/AI_ASR_model/new/audio_asr/audio_wav_75.wav  ,تمشي عند اللي خلقها,75,3.12,48000
C:/Bradai/focus/AI_ASR_model/new/audio_asr/audio_wav_76.wav  ,مالا الليلة راك من ضيافي,76,2.75,48000
C:/Bradai/focus/AI_ASR_model/new/audio_asr/audio_wav_77.wav  ,أي شبيه,77,1.63,48000
C:/Bradai/focus/AI_ASR_model/new/audio_asr/audio_wav_78.wav  ,و ضرب قلع شجرة,78,2.08,48000
C:/Bradai/focus/AI_ASR_model/new/audio_asr/audio_wav_79.wav  ,قال بش يطيب العشاء,79,2.61,48000
C:/Bradai/focus/AI_ASR_model/new/audio_asr/audio_wav_80.wav  ,تنجمش تهزها معايا,80,2.75,48000
C:/Bradai/focus/AI_ASR_model/new/audio_asr/audio_wav_81.wav  ,شمعناها ننجمشي,81,2.42,48000
C:/Bradai/focus/AI_ASR_model/new/audio_asr/audio_wav_82.wav  ,أيا هز إنت م القعمورة و أنا من الفوق,82,3.41,48000
C:/Bradai/focus/AI_ASR_model/new/audio_asr/audio_wav_83.wav  ,هو هز الشجرة و وخينا نقز شد في,83,4.15,48000
C:/Bradai/focus/AI_ASR_model/new/audio_asr/audio_wav_84.wav  ,و بدا ماشي بيه و مش فاطن,84,3.37,48000
C:/Bradai/focus/AI_ASR_model/new/audio_asr/audio_wav_85.wav  ,كيف وصلوا رمى الشجرة,85,2.58,48000
C:/Bradai/focus/AI_ASR_model/new/audio_asr/audio_wav_86.wav  ,نقز هو جا واقف قدامها,86,3.35,48000
C:/Bradai/focus/AI_ASR_model/new/audio_asr/audio_wav_87.wav  ,الغار متاعو فما جنينة و شجر,87,3.82,48000
C:/Bradai/focus/AI_ASR_model/new/audio_asr/audio_wav_88.wav  ,شجرة متع عوينة,88,2.38,48000
C:/Bradai/focus/AI_ASR_model/new/audio_asr/audio_wav_89.wav  ,هاك العوينة هذيكا طايبة,89,3.39,48000
C:/Bradai/focus/AI_ASR_model/new/audio_asr/audio_wav_90.wav  ,جبد فرع,90,2.23,48000
C:/Bradai/focus/AI_ASR_model/new/audio_asr/audio_wav_91.wav  ,هبطو لوطا و بداو ياكلوا في العوينة,91,3.49,48000
C:/Bradai/focus/AI_ASR_model/new/audio_asr/audio_wav_92.wav  ,لكن كيف شبع الغول سيب هاك الفرع هذاكا اللي كان مهبطو و شادو بيدو,92,6.02,48000
C:/Bradai/focus/AI_ASR_model/new/audio_asr/audio_wav_93.wav  ,رجع هاك الفرع وخينا شد فيه و ما عندوش جهد,93,4.42,48000
C:/Bradai/focus/AI_ASR_model/new/audio_asr/audio_wav_94.wav  ,و يمكن يوزن ثلاثين كيلو والا قداش,94,3.45,48000
C:/Bradai/focus/AI_ASR_model/new/audio_asr/audio_wav_95.wav  ,تشيع الفوق فوق الشجرة و جا لغادي منها,95,4.75,48000
C:/Bradai/focus/AI_ASR_model/new/audio_asr/audio_wav_96.wav  ,تنجمش تنقز كيفي من فوق الشجرة هكا,96,3.78,48000
C:/Bradai/focus/AI_ASR_model/new/audio_asr/audio_wav_97.wav  ,الغول ما نجمش,97,2.56,48000
C:/Bradai/focus/AI_ASR_model/new/audio_asr/audio_wav_98.wav  ,زاد كبر قدرو عندو,98,3.26,48000
C:/Bradai/focus/AI_ASR_model/new/audio_asr/audio_wav_99.wav  ,أيا دخلوا للغار,99,2.28,48000
C:/Bradai/focus/AI_ASR_model/new/audio_asr/audio_wav_200.wav ,يحكيو على زوز أخوة معرسين,100,3.35,48000
C:/Bradai/focus/AI_ASR_model/new/audio_asr/audio_wav_201.wav ,واحد عندو سبعة أولاد والثاني عندو سبعة بنات,101,4.37,48000
C:/Bradai/focus/AI_ASR_model/new/audio_asr/audio_wav_202.wav ,توفات ام البنات وقعدوا البنيات حمل على كتاف بوهم,102,5.32,48000
C:/Bradai/focus/AI_ASR_model/new/audio_asr/audio_wav_203.wav ,خوه الكبير يسافر مع اولادو ويجيب السلع ويبيع ويشري,103,5.12,48000
C:/Bradai/focus/AI_ASR_model/new/audio_asr/audio_wav_204.wav ,وحالتو ميسورة,104,2.33,48000
C:/Bradai/focus/AI_ASR_model/new/audio_asr/audio_wav_205.wav ,لكن هو ما عرفش كيفاش يعمل,105,3.47,48000
C:/Bradai/focus/AI_ASR_model/new/audio_asr/audio_wav_206.wav ,لا صاب يهزهم معاه ويسافر مع التجار,106,4.65,48000
C:/Bradai/focus/AI_ASR_model/new/audio_asr/audio_wav_207.wav ,ولا قدر يخليهم ويمشي يشوف رزقو مع خوه,107,4.84,48000
C:/Bradai/focus/AI_ASR_model/new/audio_asr/audio_wav_208.wav ,مالقاش حتى حل غير انو يخدم عند خوه,108,4.85,48000
C:/Bradai/focus/AI_ASR_model/new/audio_asr/audio_wav_209.wav ,على خاطر من بعد موت المرحومة قلت حركت و وتجارتو وولى ياكل في الربح وراس المال,109,7.54,48000
C:/Bradai/focus/AI_ASR_model/new/audio_asr/audio_wav_210.wav ,هوكة يحمل السلعة,110,2.75,48000
C:/Bradai/focus/AI_ASR_model/new/audio_asr/audio_wav_211.wav ,يهز ويجيب قضيات,111,3.4,48000
C:/Bradai/focus/AI_ASR_model/new/audio_asr/audio_wav_212.wav ,و يرد بالو على حوانت خوه كي يبدأ مسافر هو واولادو,112,4.94,48000
C:/Bradai/focus/AI_ASR_model/new/audio_asr/audio_wav_213.wav ,عايش على قد الحال,113,2.49,48000
C:/Bradai/focus/AI_ASR_model/new/audio_asr/audio_wav_214.wav ,ما يجوع ما يشبع,114,2.42,48000
C:/Bradai/focus/AI_ASR_model/new/audio_asr/audio_wav_215.wav ,ساعات كي يستحق يطلب من خوه,115,2.93,48000
C:/Bradai/focus/AI_ASR_model/new/audio_asr/audio_wav_216.wav ,يعطيه الحقيقة ما يشدش عليه,116,2.81,48000
C:/Bradai/focus/AI_ASR_model/new/audio_asr/audio_wav_217.wav ,لكن اللي يعطي يمل واللي يأخذ ما يملش كيما يقولوا,117,4.94,48000
C:/Bradai/focus/AI_ASR_model/new/audio_asr/audio_wav_218.wav ,وزيد الخو كان ديما يقلو,118,3.55,48000
C:/Bradai/focus/AI_ASR_model/new/audio_asr/audio_wav_219.wav ,حتى هوما سبعة يا خويا,119,2.85,48000
C:/Bradai/focus/AI_ASR_model/new/audio_asr/audio_wav_220.wav ,اش يحب لهم مونة وكسوة,120,3.26,48000
C:/Bradai/focus/AI_ASR_model/new/audio_asr/audio_wav_221.wav ,يجاوبو بو البنات,121,2.7,48000
C:/Bradai/focus/AI_ASR_model/new/audio_asr/audio_wav_222.wav ,رزقهم على الله,122,2.36,48000
C:/Bradai/focus/AI_ASR_model/new/audio_asr/audio_wav_223.wav ,هاو انت زادة عندك سبعة ما شاء الله,123,3.72,48000
C:/Bradai/focus/AI_ASR_model/new/audio_asr/audio_wav_224.wav ,أنا عندي سبعة فرحات,124,2.75,48000
C:/Bradai/focus/AI_ASR_model/new/audio_asr/audio_wav_225.wav ,يعاونوا ونلقاهم في الشدة,125,3.69,48000
C:/Bradai/focus/AI_ASR_model/new/audio_asr/audio_wav_226.wav ,أما انت عندك سبعة هموم,126,3.02,48000
C:/Bradai/focus/AI_ASR_model/new/audio_asr/audio_wav_227.wav ,قاعدينلك,127,2.7,48000
C:/Bradai/focus/AI_ASR_model/new/audio_asr/audio_wav_228.wav ,لا يرحمو لايخليو رحمة ربي تنزل عليك,128,3.73,48000
C:/Bradai/focus/AI_ASR_model/new/audio_asr/audio_wav_229.wav ,يبكش مسكين وما يلقى ما يقول,129,3.44,48000
C:/Bradai/focus/AI_ASR_model/new/audio_asr/audio_wav_230.wav ,يولي يبدل الهدرة والا يعمل روحو يقضي في بعض الاشغال,130,5.13,48000
C:/Bradai/focus/AI_ASR_model/new/audio_asr/audio_wav_231.wav ,باش يخبي دموع القهر,131,3.35,48000
C:/Bradai/focus/AI_ASR_model/new/audio_asr/audio_wav_232.wav ,و يروح لبناتو ساهم,132,2.7,48000
C:/Bradai/focus/AI_ASR_model/new/audio_asr/audio_wav_233.wav ,يكركر في سويقاتو,133,2.74,48000
C:/Bradai/focus/AI_ASR_model/new/audio_asr/audio_wav_234.wav ,وحتى الماكلة ما ياكلهاش,134,2.93,48000
C:/Bradai/focus/AI_ASR_model/new/audio_asr/audio_wav_235.wav ,كي ينبزو خوه ويعايرو ببناتو,135,3.82,48000
C:/Bradai/focus/AI_ASR_model/new/audio_asr/audio_wav_236.wav ,حتى نهار قالتلو بنتو الصغيرة وهي اقرب وحدة ليه,136,5.5,48000
C:/Bradai/focus/AI_ASR_model/new/audio_asr/audio_wav_237.wav ,شبيك يا بابا ديما مهموم,137,3.15,48000
C:/Bradai/focus/AI_ASR_model/new/audio_asr/audio_wav_238.wav ,اخي عمي داهك عليك بالخدمة والا قاعد يلز لك بالكلام,138,6.12,48000
C:/Bradai/focus/AI_ASR_model/new/audio_asr/audio_wav_239.wav ,كان ماكش مرتاح معاه بطل,139,3.02,48000
C:/Bradai/focus/AI_ASR_model/new/audio_asr/audio_wav_240.wav ,والله يغنينا على لقمة الذل,140,3.35,48000
C:/Bradai/focus/AI_ASR_model/new/audio_asr/audio_wav_241.wav ,دمعت عينين البو وما نجم يقول حتى كلمة,141,4.29,48000
C:/Bradai/focus/AI_ASR_model/new/audio_asr/audio_wav_242.wav ,لكن بنتو قعدت تحكي معاه وتستدرج فيه بالحديث,142,4.24,48000
C:/Bradai/focus/AI_ASR_model/new/audio_asr/audio_wav_243.wav ,حتى فقع الدمالة حاشاكم وحكالها اللي ثمة,143,4.67,48000
C:/Bradai/focus/AI_ASR_model/new/audio_asr/audio_wav_244.wav ,تنهدت الطفلة وقالت لبوها,144,3.26,48000
C:/Bradai/focus/AI_ASR_model/new/audio_asr/audio_wav_245.wav ,هذا الكل وانت مستحمل وساكت على خاطرنا,145,4.09,48000
C:/Bradai/focus/AI_ASR_model/new/audio_asr/audio_wav_246.wav ,برحمة امي في قبرها لا تعكسني ه المرة يا بابا,146,5.18,48000
C:/Bradai/focus/AI_ASR_model/new/audio_asr/audio_wav_247.wav ,وخليني ناخذ بثاري وثار اخواتي,147,3.87,48000
C:/Bradai/focus/AI_ASR_model/new/audio_asr/audio_wav_248.wav ,ونعلم عمي درس عمرو ما ينساه,148,3.73,48000
C:/Bradai/focus/AI_ASR_model/new/audio_asr/audio_wav_249.wav ,شنوة تقصد يا بنيتي,149,3.21,48000
C:/Bradai/focus/AI_ASR_model/new/audio_asr/audio_wav_250.wav ,لا ثار لا شي,150,2.42,48000
C:/Bradai/focus/AI_ASR_model/new/audio_asr/audio_wav_251.wav ,شعندنا فيه ربي يهديه,151,2.98,48000
C:/Bradai/focus/AI_ASR_model/new/audio_asr/audio_wav_252.wav ,لكن الطفلة ركبت راسها وقالتلو,152,3.2,48000
C:/Bradai/focus/AI_ASR_model/new/audio_asr/audio_wav_253.wav ,علاش الحقرة يا بابا,153,2.98,48000
C:/Bradai/focus/AI_ASR_model/new/audio_asr/audio_wav_254.wav ,ياخي انت والا امي صورتونا وخلقتونا,154,5.31,48000
C:/Bradai/focus/AI_ASR_model/new/audio_asr/audio_wav_255.wav ,ماهو خلقنا ربي كيفنا كيف اولادو,155,3.53,48000
C:/Bradai/focus/AI_ASR_model/new/audio_asr/audio_wav_256.wav ,لانا خير منهم ولاهم خير منا اللهم انت بيدك موافقو ومستعار بينا بالحق,156,6.15,48000
C:/Bradai/focus/AI_ASR_model/new/audio_asr/audio_wav_257.wav ,كلمة منا وكلمة من غادي جابت بوها في القالب,157,4.47,48000
C:/Bradai/focus/AI_ASR_model/new/audio_asr/audio_wav_258.wav ,ووافقها على مخططها بعد ما عاهدتو,158,3.67,48000
C:/Bradai/focus/AI_ASR_model/new/audio_asr/audio_wav_259.wav ,ايا بعد مديدة قرر التاجر يبعث ولدو الصغير يسافر لمدينة بعيدة شوية,159,6.72,48000
C:/Bradai/focus/AI_ASR_model/new/audio_asr/audio_wav_260.wav ,باش يجيب منها سلعة وهذي اول مرة باش يقصدها,160,4.42,48000
C:/Bradai/focus/AI_ASR_model/new/audio_asr/audio_wav_261.wav ,قال بو البنات لخوه,161,2.93,48000
C:/Bradai/focus/AI_ASR_model/new/audio_asr/audio_wav_262.wav ,حتى انا كنت عازم نبعث بنتي الصغيرة,162,4.28,48000
C:/Bradai/focus/AI_ASR_model/new/audio_asr/audio_wav_263.wav ,تجيب لي شوية سلعة قبل رمضان والعيد,163,4.33,48000
C:/Bradai/focus/AI_ASR_model/new/audio_asr/audio_wav_264.wav ,ندور الدولاب و نعاون روحي شوية,164,4.11,48000
C:/Bradai/focus/AI_ASR_model/new/audio_asr/audio_wav_265.wav ,بهت التاجر وقعد حال فمو في خوه,165,4.15,48000
C:/Bradai/focus/AI_ASR_model/new/audio_asr/audio_wav_266.wav ,تلصق أنثى في ولدي,166,4.04,48000
C:/Bradai/focus/AI_ASR_model/new/audio_asr/audio_wav_267.wav ,الطفل ماهوش ناوي ع الماخذة و هي منين ليها التجارة,167,6.46,48000
C:/Bradai/focus/AI_ASR_model/new/audio_asr/audio_wav_268.wav ,ه الشغبة اللي باش تعملها للولد,168,3.68,48000
C:/Bradai/focus/AI_ASR_model/new/audio_asr/audio_wav_269.wav ,باش يقعد يقاسي فيها ويقري ويوري والا باش يتلهى بخدمتو وامورو,169,5.91,48000
C:/Bradai/focus/AI_ASR_model/new/audio_asr/audio_wav_270.wav ,فهم بو البنات قصد خوه,170,4.09,48000
C:/Bradai/focus/AI_ASR_model/new/audio_asr/audio_wav_271.wav ,لكن كتم داه في رداه و سكت,171,3.49,48000
C:/Bradai/focus/AI_ASR_model/new/audio_asr/audio_wav_272.wav ,الاخر يغلي ويهز ويصبط وخوه داز النح وعامل وذنين عروسة,172,6.05,48000
C:/Bradai/focus/AI_ASR_model/new/audio_asr/audio_wav_273.wav ,وفي الاخر مشى كلام الطفلة وشدت الثنية مع ولد عمها,173,4.98,48000
C:/Bradai/focus/AI_ASR_model/new/audio_asr/audio_wav_274.wav ,هو هز زادوا وزوادو وبرشة فلوس وفرس ومقرون,174,5.58,48000
C:/Bradai/focus/AI_ASR_model/new/audio_asr/audio_wav_275.wav ,وهي مسكينة عطاها بوها زوز صوردي مخبيهم لدواير الزمان خباتهم في شونها على ماياتي,175,7.65,48000
C:/Bradai/focus/AI_ASR_model/new/audio_asr/audio_wav_276.wav ,بالبسيسة والزيت وخبز الشعير والماء وشوية سمن وعسل وكعيبات دقلة وطمطومات وشوية غلة,176,8.98,48000
C:/Bradai/focus/AI_ASR_model/new/audio_asr/audio_wav_277.wav ,تدور في الدار وتتفتف حتى دبرت مونة الطريق و بزايد زادة,177,5.77,48000
C:/Bradai/focus/AI_ASR_model/new/audio_asr/audio_wav_278.wav ,حطتهم على بهيمة بوها خاطر هذاك اش يكسبوا,178,4.23,48000
C:/Bradai/focus/AI_ASR_model/new/audio_asr/audio_wav_279.wav ,وتوكلت على الله,179,2.46,48000
C:/Bradai/focus/AI_ASR_model/new/audio_asr/audio_wav_280.wav ,شدوا الطريق العازب من قدام والطفلة من تالي,180,4.1,48000
C:/Bradai/focus/AI_ASR_model/new/audio_asr/audio_wav_281.wav ,الفرس مرة تركض مرة تهرول مرة تمشي,181,4.19,48000
C:/Bradai/focus/AI_ASR_model/new/audio_asr/audio_wav_282.wav ,والبهيمة الشارفة تدبك بالشوية بالشوية,182,3.76,48000
C:/Bradai/focus/AI_ASR_model/new/audio_asr/audio_wav_283.wav ,والطفلة مرة تركب والاكثرية تسخف ع البكمة وتهبط تمشي على سويقاتها,183,5.74,48000
C:/Bradai/focus/AI_ASR_model/new/audio_asr/audio_wav_284.wav ,وولد العم مرة يسبقها وياقف يستناها,184,3.82,48000
C:/Bradai/focus/AI_ASR_model/new/audio_asr/audio_wav_285.wav ,ومرة يرجعلها وهو يصيح ويلعن في النهار,185,4.05,48000
C:/Bradai/focus/AI_ASR_model/new/audio_asr/audio_wav_286.wav ,وهي عاملة مولى الدار موش هوني,186,3.07,48000
C:/Bradai/focus/AI_ASR_model/new/audio_asr/audio_wav_287.wav ,و يمين البكوش في صدرو,187,2.97,48000
C:/Bradai/focus/AI_ASR_model/new/audio_asr/audio_wav_288.wav ,كي يجوعوا ياقفو في بلاصة ظل,188,3.79,48000
C:/Bradai/focus/AI_ASR_model/new/audio_asr/audio_wav_289.wav ,الطفلة ماو متعودة بالاقتصاد وقلة التبذير,189,4.41,48000
C:/Bradai/focus/AI_ASR_model/new/audio_asr/audio_wav_290.wav ,تاكل قدمة وتخبي قدمة,190,2.9,48000
C:/Bradai/focus/AI_ASR_model/new/audio_asr/audio_wav_291.wav ,تشرب رشفة وتعطي رشفة للبكمة وتخبي القربة,191,5.0,48000
C:/Bradai/focus/AI_ASR_model/new/audio_asr/audio_wav_292.wav ,اما الطفل ماو متعود ع الدلال والخيرات,192,3.87,48000
C:/Bradai/focus/AI_ASR_model/new/audio_asr/audio_wav_293.wav ,كل شوية يجبد الماكلة اللي حضرتهالو امو يضربها قد قد,193,4.83,48000
C:/Bradai/focus/AI_ASR_model/new/audio_asr/audio_wav_294.wav ,ويشرب الماء على كيف كيفو ويزيد يصب على رأسو ويبرد سويقاتو,194,5.77,48000
C:/Bradai/focus/AI_ASR_model/new/audio_asr/audio_wav_295.wav ,تعدات ثلاثة ايام حتى وفات المونة متاعو وبدأ ياكل فيه الجوع,195,6.24,48000
C:/Bradai/focus/AI_ASR_model/new/audio_asr/audio_wav_296.wav ,والطفلة تلاحظ في كل شيء وساكتة,196,3.49,48000
C:/Bradai/focus/AI_ASR_model/new/audio_asr/audio_wav_297.wav ,صبر المغبون صبر وقاللها,197,3.34,48000
